id,Volcano_Number,Volcano_Name,Volcanic_Landform,Primary_Volcano_Type,Last_Eruption_Year,Country,Region,Subregion,Geological_Summary,Latitude,Longitude,Elevation,Tectonic_Setting,Geologic_Epoch,Evidence_Category,Primary_Photo_Link,Primary_Photo_Caption,Primary_Photo_Credit,Major_Rock_Type,x_coordinate,y_coordinate,date,source,buffer_km
Smithsonian_VOTW_Holocene_Volcanoes.fid--4369a657_19aedf6ae3d_ee8,261140,Marapi,Composite,Complex,2025.0,Indonesia,Sunda-Banda Volcanic Regions,Sunda Volcanic Arc,"Gunung Marapi, not to be confused with the better-known Merapi volcano on Java, is Sumatra's most active volcano. This massive complex stratovolcano rises 2,000 m above the Bukittinggi Plain in the Padang Highlands. A broad summit contains multiple partially overlapping summit craters constructed within the small 1.4-km-wide Bancah caldera. The summit craters are located along an ENE-WSW line, with volcanism migrating to the west. More than 50 eruptions, typically consisting of small-to-moderate explosive activity, have been recorded since the end of the 18th century; no lava flows outside the summit craters have been reported in historical time.",-0.38,100.474,2885,Subduction zone / Continental crust (> 25 km),Holocene,Eruption Observed,https://volcano.si.edu/gallery/photos/GVP-12022.jpg,"Marapi, seen here in front of above rice fields, is Sumatra's most active volcano. More than 50 small-to-moderate explosive eruptions have occurred since the end of the 18th century. Marapi, not to be confused with the more well-known Merapi volcano on Java, has multiple summit craters and reaches 2,000 m above the Padang Highlands in central Sumatra.","Photo by Amin, 2003 (Centre of Volcanology & Geological Hazard Mitigation, Volcanological Survey of Indonesia).",Andesite / Basaltic Andesite,100.474,-0.38,2025-12-04,erupting,30
Smithsonian_VOTW_Holocene_Volcanoes.fid--4369a657_19aedf6ae3d_f05,263250,Merapi,Composite,Stratovolcano,2025.0,Indonesia,Sunda-Banda Volcanic Regions,Sunda Volcanic Arc,"Merapi, one of Indonesia's most active volcanoes, lies in one of the world's most densely populated areas and dominates the landscape immediately north of the major city of Yogyakarta. It is the youngest and southernmost of a volcanic chain extending NNW to Ungaran volcano. Growth of Old Merapi during the Pleistocene ended with major edifice collapse perhaps about 2,000 years ago, leaving a large arcuate scarp cutting the eroded older Batulawang volcano. Subsequent growth of the steep-sided Young Merapi edifice, its upper part unvegetated due to frequent activity, began SW of the earlier collapse scarp. Pyroclastic flows and lahars accompanying growth and collapse of the steep-sided active summit lava dome have devastated cultivated lands on the western-to-southern flanks and caused many fatalities.",-7.54,110.446,2910,Subduction zone / Continental crust (> 25 km),Holocene,Eruption Observed,https://volcano.si.edu/gallery/photos/GVP-01722.jpg,"Merapi in central Java is capped by an unvegetated lava dome complex. The modern edifice of Merapi, to the left in this view, is constructed to the SE of the arcuate scarp on the right that was formed by destruction of the older Batulawang volcano. Periodic growth and collapse of lava domes produce pyroclastic flows (block-and-ash flows) and lahars that have devastated populated areas below the volcano.","Photo by Yustinus Sulistiyo, 1994 (Volcanological Survey of Indonesia).",Andesite / Basaltic Andesite,110.446,-7.54,2025-12-04,erupting,30
Smithsonian_VOTW_Holocene_Volcanoes.fid--4369a657_19aedf6ae3d_f0b,263300,Semeru,Composite,Stratovolcano,2025.0,Indonesia,Sunda-Banda Volcanic Regions,Sunda Volcanic Arc,"Semeru, the highest volcano on Java, and one of its most active, lies at the southern end of a volcanic massif extending north to the Tengger caldera. The steep-sided volcano, also referred to as Mahameru (Great Mountain), rises above coastal plains to the south.  Gunung Semeru was constructed south of the overlapping Ajek-ajek and Jambangan calderas. A line of lake-filled maars was constructed along a N-S trend cutting through the summit, and cinder cones and lava domes occupy the eastern and NE flanks. Summit topography is complicated by the shifting of craters from NW to SE. Frequent 19th and 20th century eruptions were dominated by small-to-moderate explosions from the summit crater, with occasional lava flows and larger explosive eruptions accompanied by pyroclastic flows that have reached the lower flanks of the volcano.",-8.108,112.922,3657,Subduction zone / Continental crust (> 25 km),Holocene,Eruption Observed,https://volcano.si.edu/gallery/photos/GVP-00736.jpg,"Semeru volcano rises above the coastal plain in Java, shown here producing a small ash plume in 1985. Larger eruptions occasionally produce pyroclastic flows and lahars that reach as far as the lower flanks of the volcano. Semeru (also known as Mahameru: ""Great Mountain"") has been in near-continuous activity since 1818.","Photo by Tom Casadevall, 1985 (U.S. Geological Survey).",Andesite / Basaltic Andesite,112.922,-8.108,2025-12-04,erupting,30
Smithsonian_VOTW_Holocene_Volcanoes.fid--4369a657_19aedf6ae3d_f0f,263340,Raung,Composite,Stratovolcano,2025.0,Indonesia,Sunda-Banda Volcanic Regions,Sunda Volcanic Arc,"Raung, one of Java's most active volcanoes, is a massive stratovolcano in easternmost Java that was constructed SW of the rim of Ijen caldera. The unvegetated summit is truncated by a dramatic steep-walled, 2-km-wide caldera that has been the site of frequent historical eruptions. A prehistoric collapse of Gunung Gadung on the W flank produced a large debris avalanche that traveled 79 km, reaching nearly to the Indian Ocean. Raung contains several centers constructed along a NE-SW line, with Gunung Suket and Gunung Gadung stratovolcanoes being located to the NE and W, respectively.",-8.119,114.056,3260,Subduction zone / Continental crust (> 25 km),Holocene,Eruption Observed,https://volcano.si.edu/gallery/photos/GVP-01143.jpg,"Raung volcano, near the eastern tip of Java, contains a 2-km-wide summit caldera. One of Java's most active volcanoes, Raung produces frequent moderate explosive eruptions, like this one in 1988 from a cone within the caldera, that keep the upper flanks of the volcano sparsely vegetated. Raung forms part of a NW-SE-trending chain of volcanoes constructed near the SW rim of Ijen caldera.","Photo by Willem Rohi, 1988 (Volcanological Survey of Indonesia).",Andesite / Basaltic Andesite,114.056,-8.119,2025-12-04,erupting,30
Smithsonian_VOTW_Holocene_Volcanoes.fid--4369a657_19aedf6ae3d_f21,264180,Lewotobi,Composite,Stratovolcano(es),2025.0,Indonesia,Sunda-Banda Volcanic Regions,Sunda Volcanic Arc,"The Lewotobi edifice in eastern Flores Island is composed of the two adjacent Lewotobi Laki-laki and Lewotobi Perempuan stratovolcanoes (the ""husband and wife""). Their summits are less than 2 km apart along a NW-SE line. The conical Laki-laki to the NW has been frequently active during the 19th and 20th centuries, while the taller and broader Perempuan has had observed eruptions in 1921 and 1935. Small lava domes have grown during the 20th century in both of the summit craters, which are open to the north. A prominent cone, Iliwokar, occurs on the E flank of Perampuan.",-8.542,122.775,1703,Subduction zone / Crustal thickness unknown,Holocene,Eruption Observed,https://volcano.si.edu/gallery/photos/GVP-11759.jpg,Lewotobi Lakilaki (left) and Lewotobi Perempuan (right) rise above forests on their western flanks. They were constructed along a NW-SE-trending line. Both volcanoes have erupted during historical time but Lakilaki has been more active.,"Photo by Joël Boyer, 2004 (L.A.V.E.)",Andesite / Basaltic Andesite,122.775,-8.542,2025-12-04,erupting,30
Smithsonian_VOTW_Holocene_Volcanoes.fid--4369a657_19aedf6ae3d_f6f,282080,Aira,Caldera,Caldera,2025.0,Japan,Western Pacific Volcanic Regions,Ryukyu Volcanic Arc,"The Aira caldera in the northern half of Kagoshima Bay contains the post-caldera Sakurajima volcano, one of Japan's most active. Eruption of the voluminous Ito pyroclastic flow accompanied formation of the 17 x 23 km caldera about 22,000 years ago. The smaller Wakamiko caldera was formed during the early Holocene in the NE corner of the caldera, along with several post-caldera cones. The construction of Sakurajima began about 13,000 years ago on the southern rim and built an island that was joined to the Osumi Peninsula during the major explosive and effusive eruption of 1914. Activity at the Kitadake summit cone ended about 4,850 years ago, after which eruptions took place at Minamidake. Frequent eruptions since the 8th century have deposited ash on the city of Kagoshima, located across Kagoshima Bay only 8 km from the summit. The largest recorded eruption took place during 1471-76.",31.5772,130.6589,1117,Subduction zone / Continental crust (> 25 km),Holocene,Eruption Observed,https://volcano.si.edu/gallery/photos/GVP-10567.jpg,"A plume rises above the Minamidake crater on Sakurajima. Activity at Kitadake, the peak to the right in this view from the SE, ended about 4,850 years ago, after which eruptions took place at Minamidake. Sakurajima is one of Japan's most active volcanoes and is a post-caldera cone in the Aira caldera at the northern half of Kagoshima Bay. Frequent historical eruptions have deposited ash across the bay on Kagoshima, one of Kyushu's largest cities.","Copyrighted photo by Shun Nakano (Japanese Quaternary Volcanoes database, RIODB, http://riodb02.ibase.aist.go.jp/strata/VOL_JP/EN/index.htm and Geol Surv Japan, AIST, http://www.gsj.jp/).",Andesite / Basaltic Andesite,130.6589,31.5772,2025-12-04,erupting,30
Smithsonian_VOTW_Holocene_Volcanoes.fid--4369a657_19aedf6ae3d_1063,311120,Great Sitkin,Composite,Stratovolcano,2025.0,United States,North America Volcanic Regions,Aleutian Ridge Volcanic Arc,"The Great Sitkin volcano forms much of the northern side of Great Sitkin Island. A younger volcano capped by a small, 0.8 x 1.2 km ice-filled summit caldera was constructed within a large late-Pleistocene or early Holocene scarp formed by massive edifice failure that truncated an older edifice and produced a submarine debris avalanche. Deposits from this and an even older debris avalanche from a source to the south cover a broad area of the ocean floor north of the volcano. The summit lies along the eastern rim of the younger collapse scarp. Deposits from an earlier caldera-forming eruption of unknown age cover the flanks of the island to a depth up to 6 m. The small younger caldera was partially filled by lava domes emplaced in 1945 and 1974, and five small older flank lava domes, two of which lie on the coastline, were constructed along northwest- and NNW-trending lines. Hot springs, mud pots, and fumaroles occur near the head of Big Fox Creek, south of the volcano. Eruptions have been recorded since the late-19th century.",52.076,-176.13,1740,Subduction zone / Intermediate crust (15-25 km),Holocene,Eruption Observed,https://volcano.si.edu/gallery/photos/GVP-08562.jpg,"Great Sitkin in the Andreanof Islands is seen here from Finger Bay on Adak Island. The edifice was constructed within a caldera, part of which forms the high snow-covered peak to the right. The post-caldera cone contains a 0.8 x 1.2 km ice-filled summit crater. The rim forms the irregular summit on the left horizon. A lava dome 400-600 m wide was emplaced through a glacier in 1945.","Photo by Fred Zeillemaker, 1982 (U.S. Fish and Wildlife Service, courtesy of Alaska Volcano Observatory).",Andesite / Basaltic Andesite,-176.13,52.076,2025-12-04,erupting,30
Smithsonian_VOTW_Holocene_Volcanoes.fid--4369a657_19aedf6ae3d_117b,352010,Reventador,Composite,Stratovolcano,2025.0,Ecuador,South America Volcanic Regions,Northern Andean Volcanic Arc,"Volcán El Reventador is the most frequently active of a chain of Ecuadorian volcanoes in the Cordillera Real, well east of the principal volcanic axis. The forested, dominantly andesitic stratovolcano has 4-km-wide avalanche scarp open to the E formed by edifice collapse. A young, unvegetated, cone rises from the amphitheater floor to a height comparable to the rim. It has been the source of numerous lava flows as well as explosive eruptions visible from Quito, about 90 km ESE. Frequent lahars in this region of heavy rainfall have left extensive deposits on the scarp slope. The largest recorded eruption took place in 2002, producing a 17-km-high eruption column, pyroclastic flows that traveled up to 8 km, and lava flows from summit and flank vents.",-0.077,-77.656,3562,Subduction zone / Continental crust (> 25 km),Holocene,Eruption Observed,https://volcano.si.edu/gallery/photos/GVP-11671.jpg,"A steam-and-gas plume rises from the central cone of Reventador volcano in this March 11, 2005 aerial view from the SE.  Several lava flows generated during eruptions in 2002 and 2004-2005 are visible on the south and SE flanks of the central cone.  The 3562-m-high central cone was constructed within the large 4-km-wide horseshoe-shaped caldera breached to the east (lower right).  The caldera was formed during a major collapse of the volcano, which produced a massive debris avalanche that swept into the Amazon basin.","Photo by Patricio Ramon, 2005 (Instituto Geofisca, Escuela Politecnica Nacional).",Andesite / Basaltic Andesite,-77.656,-0.077,2025-12-04,erupting,30
Smithsonian_VOTW_Holocene_Volcanoes.fid--4369a657_19aedf6ae3d_1188,352090,Sangay,Composite,Stratovolcano,2025.0,Ecuador,South America Volcanic Regions,Northern Andean Volcanic Arc,"The isolated Sangay volcano, located east of the Andean crest, is the southernmost of Ecuador's volcanoes and its most active. The steep-sided, glacier-covered, dominantly andesitic volcano grew within the open calderas of two previous edifices which were destroyed by collapse to the east, producing large debris avalanches that reached the Amazonian lowlands. The modern edifice dates back to at least 14,000 years ago. It towers above the tropical jungle on the east side; on the other sides flat plains of ash have been eroded by heavy rains into steep-walled canyons up to 600 m deep. The earliest report of an eruption was in 1628. Almost continuous eruptions were reported from 1728 until 1916, and again from 1934 to the present. The almost constant activity has caused frequent changes to the morphology of the summit crater complex.",-2.005,-78.341,5286,Subduction zone / Continental crust (> 25 km),Holocene,Eruption Observed,https://volcano.si.edu/gallery/photos/GVP-04490.jpg,"The isolated Sangay volcano towers above tropical jungles east of the Andean crest.  Seen here from the NE, it is one of Ecuador's most active volcanoes and has been in frequent eruption during the past several centuries.  The steep-sided, glacier-covered volcano has been constructed within the older Verdeloma somma to the south.  Historical eruptions were first reported in 1628.  More-or-less continuous eruptions took place from 1728 until 1916, and again from 1934 until the present.   ","Photo by Minard Hall, 1976 (Escuela Politécnica Nacional, Quito).",Andesite / Basaltic Andesite,-78.341,-2.005,2025-12-04,erupting,30
Smithsonian_VOTW_Holocene_Volcanoes.fid--4369a657_19aedf6ae3d_119b,354006,Sabancaya,Composite,Stratovolcano(es),2025.0,Peru,South America Volcanic Regions,Central Andean Volcanic Arc,"Sabancaya, located in the saddle NE of Ampato and SE of Hualca Hualca volcanoes, is the youngest of these volcanic centers and the only one to have erupted in historical time. The oldest of the three, Nevado Hualca Hualca, is of probable late-Pliocene to early Pleistocene age. The name Sabancaya (meaning ""tongue of fire"" in the Quechua language) first appeared in records in 1595 CE, suggesting activity prior to that date. Holocene activity has consisted of Plinian eruptions followed by emission of voluminous andesitic and dacitic lava flows, which form an extensive apron around the volcano on all sides but the south. Records of observed eruptions date back to 1750 CE.",-15.787,-71.857,5960,Subduction zone / Continental crust (> 25 km),Holocene,Eruption Observed,https://volcano.si.edu/gallery/photos/GVP-04768.jpg,"The Sabancaya volcanic complex consists of Sabancaya volcano proper (foreground), the older 6288-m-high Ampato volcano (background), and 6025-m Hualca Hualca volcano.  Sabancaya, viewed here from the NE, is constructed on the saddle between the two older volcanoes.  It is the youngest of the three Holocene volcanic centers and the only one to have erupted in historical time.  An extensive 15-km-wide apron of trachytic and dacitic lava flows surrounds the 5967-m-high volcano.  Records of historical eruptions date back to 1750.","Photo by Norm Banks, 1988 (U.S. Geological Survey).",Andesite / Basaltic Andesite,-71.857,-15.787,2025-12-04,erupting,30
Smithsonian_VOTW_Holocene_Volcanoes.fid--4369a657_19aedf6ae3d_f38,267040,Awu,Composite,Stratovolcano,2004.0,Indonesia,Western Pacific Volcanic Regions,Sangihe Volcanic Arc,"The massive Gunung Awu stratovolcano occupies the northern end of Great Sangihe Island, the largest of the Sangihe arc. Deep valleys that form passageways for lahars dissect the flanks of the volcano, which was constructed within a 4.5-km-wide caldera. Powerful explosive eruptions in 1711, 1812, 1856, 1892, and 1966 produced devastating pyroclastic flows and lahars that caused more than 8000 cumulative fatalities. Awu contained a summit crater lake that was 1 km wide and 172 m deep in 1922, but was largely ejected during the 1966 eruption.",3.689,125.447,1318,Subduction zone / Oceanic crust (< 15 km),Holocene,Eruption Observed,https://volcano.si.edu/gallery/photos/GVP-12023.jpg,"A shallow lake partially fills the summit crater of Awu volcano in this 1995 view.  Gunung Awu volcano, one of the deadliest in Indonesia, is cut by deep valleys that form passageways for lahars dissect the flanks of the 1320-m-high volcano.  Powerful explosive eruptions in 1711, 1812, 1856, 1892, and 1966 produced devastating pyroclastic flows and lahars that caused more than 8000 fatalities.  ","Photo by Kristianto, 1995 (Centre of Volcanology & Geological Hazard Mitigation, Volcanological Survey of Indonesia).",Andesite / Basaltic Andesite,125.447,3.689,2025-12-04,unrest,30
Smithsonian_VOTW_Holocene_Volcanoes.fid--4369a657_19aedf6ae3d_1079,311360,Shishaldin,Composite,Stratovolcano,2023.0,United States,North America Volcanic Regions,Aleutian Ridge Volcanic Arc,"The symmetrical glacier-covered Shishaldin in the Aleutian Islands is the westernmost of three large stratovolcanoes in the eastern half of Unimak Island. The Aleuts named the volcano Sisquk, meaning ""mountain which points the way when I am lost."" Constructed atop an older glacially dissected edifice, it is largely basaltic in composition. Remnants of an older edifice are exposed on the W and NE sides at 1,500-1,800 m elevation. There are over two dozen pyroclastic cones on its NW flank, which is covered by massive aa lava flows. Frequent explosive activity, primarily consisting of Strombolian ash eruptions from the small summit crater, but sometimes producing lava flows, has been recorded since the 18th century. A steam plume often rises from the summit crater.",54.756,-163.97,2857,Subduction zone / Continental crust (> 25 km),Holocene,Eruption Observed,https://volcano.si.edu/gallery/photos/GVP-05369.jpg,"Shishaldin, located on central Unimak Island in the Aleutians, has a summit crater that emits a nearly continuous plume. It is the highest and one of the most active volcanoes of the Aleutian Islands. There have been frequent Strombolian eruptions, sometimes with lava flows, since the 18th century.","Photo by Chris Nye (Alaska Division of Geological & Geophysical Surveys, Alaska Volcano Observatory).",Basalt / Picro-Basalt,-163.97,54.756,2025-12-04,unrest,30
Smithsonian_VOTW_Holocene_Volcanoes.fid--4369a657_19aedf6ae3d_1164,345070,Turrialba,Composite,Stratovolcano,2022.0,Costa Rica,Middle America-Caribbean Volcanic Regions,Central America Volcanic Arc,"Turrialba, the easternmost of Costa Rica's Holocene volcanoes, is a large vegetated basaltic-to-dacitic stratovolcano located across a broad saddle NE of Irazú volcano overlooking the city of Cartago. The massive edifice covers an area of 500 km2. Three well-defined craters occur at the upper SW end of a broad 800 x 2200 m summit depression that is breached to the NE. Most activity originated from the summit vent complex, but two pyroclastic cones are located on the SW flank. Five major explosive eruptions have occurred during the past 3500 years. A series of explosive eruptions during the 19th century were sometimes accompanied by pyroclastic flows. Fumarolic activity continues at the central and SW summit craters.",10.025,-83.767,3340,Subduction zone / Continental crust (> 25 km),Holocene,Eruption Observed,https://volcano.si.edu/gallery/photos/GVP-09636.jpg,"The Turrialba summit crater complex is seen here from the north, with the Central Valley of Costa Rica in the background. Three well-defined craters can be seen at the upper SW end of the broad summit area. Hydrothermally altered deposits can be seen at the central and SW summit craters (right), where geothermal activity continues. ","Photo by Federico Chavarria Kopper, 1999.",Andesite / Basaltic Andesite,-83.767,10.025,2025-12-04,unrest,30
Smithsonian_VOTW_Holocene_Volcanoes.fid--4369a657_19aedf6ae3d_eeb,261170,Kerinci,Composite,Stratovolcano,2024.0,Indonesia,Sunda-Banda Volcanic Regions,Sunda Volcanic Arc,"Gunung Kerinci in central Sumatra forms Indonesia's highest volcano and is one of the most active in Sumatra. It is capped by an unvegetated young summit cone that was constructed NE of an older crater remnant. There is a deep 600-m-wide summit crater often partially filled by a small crater lake that lies on the NE crater floor, opposite the SW-rim summit. The massive 13 x 25 km wide volcano towers 2400-3300 m above surrounding plains and is elongated in a N-S direction. Frequently active, Kerinci has been the source of numerous moderate explosive eruptions since its first recorded eruption in 1838.",-1.697,101.264,3800,Subduction zone / Continental crust (> 25 km),Holocene,Eruption Observed,https://volcano.si.edu/gallery/photos/GVP-12030.jpg,The unvegetated summit of Gunung Kerinci in central Sumatra is seen here from Pengamatan on its southern flank. Kerinci is one of the most active volcanoes in Sumatra and has been the source of numerous moderate explosive eruptions since its first recorded eruption in 1838. The 13 x 25 km wide volcano rises above the surrounding plains.,"Photo by Umar Rosadi,  2005 (Centre of Volcanology & Geological Hazard Mitigation, Volcanological Survey of Indonesia).",Andesite / Basaltic Andesite,101.264,-1.697,2025-12-04,unrest,30
Smithsonian_VOTW_Holocene_Volcanoes.fid--4369a657_19aedf6ae3d_f25,264250,Iliwerung,Composite,Complex,2021.0,Indonesia,Sunda-Banda Volcanic Regions,Sunda Volcanic Arc,"Constructed on the southern rim of the Lerek caldera, Iliwerung forms a prominent south-facing peninsula on Lembata (formerly Lomblen) Island. Craters and lava domes have formed along N-S and NW-SE lines on the complex volcano; activity has been observed at vents from the summit to the submarine SE flank. The summit lava dome was formed during an eruption in 1870. In 1948 the Iligripe lava dome grew on the E flank at 120 m elevation. Beginning in 1973-74, when three ephemeral islands were formed, submarine eruptions began on the lower ESE flank at a vent named Hobal; several other eruptions have since taken place at this vent.",-8.532,123.573,583,Subduction zone / Crustal thickness unknown,Holocene,Eruption Observed,https://volcano.si.edu/gallery/photos/GVP-10071.jpg,"A lava dome, formed during the first historical eruption of Iliwerung volcano in 1870, occupies the summit crater of the volcano, seen here in 1979 from the rim of Ado Wajung crater.  Iliwerung forms one of the south-facing peninsulas on Lembata (formerly Lomblen) Island, and has a series of lava domes and craters along N-S and NW-SE lines.  Many of these vents, including submarine vents offshore, have erupted in historical time.",Photo by Volcanological Survey of Indonesia.,Basalt / Picro-Basalt,123.573,-8.532,2025-12-04,unrest,30
Smithsonian_VOTW_Holocene_Volcanoes.fid--4369a657_19aedf6ae3d_f30,266030,Soputan,Composite,Stratovolcano,2020.0,Indonesia,Western Pacific Volcanic Regions,Sangihe Volcanic Arc,"The Soputan stratovolcano on the southern rim of the Quaternary Tondano caldera on the northern arm of Sulawesi Island is one of Sulawesi's most active volcanoes. The youthful, largely unvegetated volcano is the only active cone in the Sempu-Soputan volcanic complex, which includes the Soputan caldera, Rindengan, and Manimporok (3.5 km ESE). Kawah Masem maar was formed in the W part of the caldera and contains a crater lake; sulfur has been extracted from fumarolic areas in the maar since 1938. Recent eruptions have originated at both the summit crater and Aeseput, a prominent NE-flank vent that formed in 1906 and was the source of intermittent major lava flows until 1924.",1.112,124.737,1785,Subduction zone / Continental crust (> 25 km),Holocene,Eruption Observed,https://volcano.si.edu/gallery/photos/GVP-10069.jpg,"The small Soputan stratovolcano, seen here from the west, was constructed on the southern rim of the Quaternary Tondano caldera in northern Sulawesi Island.  The youthful, largely unvegetated Soputan volcano  is one of Sulawesi's most active volcanoes.  During historical time the locus of eruptions has included both the summit crater and Aeseput, a prominent NE flank vent that formed in 1906 and was the source of intermittent major lava flows until 1924.    ",Photo by Agus Solihin (Volcanological Survey of Indonesia).,Andesite / Basaltic Andesite,124.737,1.112,2025-12-04,unrest,30
